{
  "id": "musk-wrist-mri",
  "name": "Wrist MRI",
  "version": "1.0.0",
  "description": "MRI of the wrist for triangular fibrocartilage, carpal bones, and tendon evaluation",
  "modality": "mri",
  "bodyRegion": "musculoskeletal",
  "subspecialty": "musculoskeletal",
  "metadata": {
    "author": "RadReport Templates",
    "license": "MIT",
    "tags": ["musculoskeletal", "wrist", "mri", "tfcc", "carpal"]
  },
  "findings": {
    "technique": "MRI of the wrist was performed with T1, T2, and fat-saturated sequences.",
    "comparison": "No prior studies available for comparison.",
    "limitations": "None",
    "sections": [
      {
        "name": "TFCC",
        "content": "Triangular fibrocartilage complex [intact / no tear / no perforation].",
        "normalVariant": true
      },
      {
        "name": "Carpal Bones",
        "content": "Carpal bones [no fracture / no AVN / no bone marrow edema]. Scapholunate ligament [intact].",
        "normalVariant": true
      },
      {
        "name": "Tendons",
        "content": "Extensor tendons [intact]. Flexor tendons [intact].",
        "normalVariant": true
      }
    ]
  },
  "impression": "1. No TFCC tear.\n2. No carpal instability.\n3. Normal wrist MRI.",
  "createdAt": "2026-03-31T00:00:00.000Z",
  "updatedAt": "2026-03-31T00:00:00.000Z",
  "author": "RadReport Templates"
}